{
  "/Users/user/Projects/transport-system-management/serverless.yml": {
    "versionFramework": "4.29.0",
    "servicePath": "/Users/user/Projects/transport-system-management/serverless.yml",
    "serviceConfigFileName": "serverless.yml",
    "service": {
      "service": "transport-system-management",
      "frameworkVersion": "4",
      "provider": {
        "name": "aws",
        "runtime": "nodejs20.x",
        "region": "eu-central-1",
        "stage": "dev",
        "timeout": 30,
        "environment": {
          "AWS_REGION": "eu-central-1",
          "AWS_DYNAMODB_ENDPOINT": "https://dynamodb.eu-central-1.amazonaws.com"
        },
        "iam": {
          "role": {
            "statements": [
              {
                "Effect": "Allow",
                "Action": [
                  "dynamodb:DescribeTable",
                  "dynamodb:CreateTable",
                  "dynamodb:DeleteTable",
                  "dynamodb:UpdateTable",
                  "dynamodb:PutItem",
                  "dynamodb:GetItem",
                  "dynamodb:UpdateItem",
                  "dynamodb:DeleteItem",
                  "dynamodb:Query",
                  "dynamodb:Scan",
                  "dynamodb:TransactWriteItems"
                ],
                "Resource": [
                  {
                    "Fn::GetAtt": [
                      "RoutesTable",
                      "Arn"
                    ]
                  },
                  {
                    "Fn::GetAtt": [
                      "VehiclesTable",
                      "Arn"
                    ]
                  },
                  {
                    "Fn::Join": [
                      "",
                      [
                        {
                          "Fn::GetAtt": [
                            "RoutesTable",
                            "Arn"
                          ]
                        },
                        "/index/*"
                      ]
                    ]
                  },
                  {
                    "Fn::Join": [
                      "",
                      [
                        {
                          "Fn::GetAtt": [
                            "VehiclesTable",
                            "Arn"
                          ]
                        },
                        "/index/*"
                      ]
                    ]
                  }
                ]
              }
            ]
          }
        },
        "versionFunctions": true
      },
      "functions": {
        "api": {
          "handler": "src/lambda.handler",
          "events": [
            {
              "httpApi": "*"
            }
          ]
        }
      },
      "plugins": [
        "serverless-offline"
      ],
      "build": {
        "esbuild": {
          "bundle": true,
          "minify": false,
          "sourcemap": true,
          "target": "node20",
          "external": [
            "@aws-sdk/*"
          ]
        }
      },
      "resources": {
        "Resources": {
          "RoutesTable": {
            "Type": "AWS::DynamoDB::Table",
            "Properties": {
              "TableName": "Routes",
              "BillingMode": "PAY_PER_REQUEST",
              "AttributeDefinitions": [
                {
                  "AttributeName": "id",
                  "AttributeType": "S"
                },
                {
                  "AttributeName": "status",
                  "AttributeType": "S"
                },
                {
                  "AttributeName": "vehicleId",
                  "AttributeType": "S"
                },
                {
                  "AttributeName": "requiredTransportType",
                  "AttributeType": "S"
                }
              ],
              "KeySchema": [
                {
                  "AttributeName": "id",
                  "KeyType": "HASH"
                }
              ],
              "GlobalSecondaryIndexes": [
                {
                  "IndexName": "StatusIndex",
                  "KeySchema": [
                    {
                      "AttributeName": "status",
                      "KeyType": "HASH"
                    }
                  ],
                  "Projection": {
                    "ProjectionType": "ALL"
                  }
                },
                {
                  "IndexName": "TransportTypeIndex",
                  "KeySchema": [
                    {
                      "AttributeName": "requiredTransportType",
                      "KeyType": "HASH"
                    },
                    {
                      "AttributeName": "status",
                      "KeyType": "RANGE"
                    }
                  ],
                  "Projection": {
                    "ProjectionType": "ALL"
                  }
                },
                {
                  "IndexName": "VehicleIdIndex",
                  "KeySchema": [
                    {
                      "AttributeName": "vehicleId",
                      "KeyType": "HASH"
                    }
                  ],
                  "Projection": {
                    "ProjectionType": "ALL"
                  }
                }
              ]
            }
          },
          "VehiclesTable": {
            "Type": "AWS::DynamoDB::Table",
            "Properties": {
              "TableName": "Vehicles",
              "BillingMode": "PAY_PER_REQUEST",
              "AttributeDefinitions": [
                {
                  "AttributeName": "id",
                  "AttributeType": "S"
                },
                {
                  "AttributeName": "status",
                  "AttributeType": "S"
                },
                {
                  "AttributeName": "transportType",
                  "AttributeType": "S"
                },
                {
                  "AttributeName": "licensePlate",
                  "AttributeType": "S"
                }
              ],
              "KeySchema": [
                {
                  "AttributeName": "id",
                  "KeyType": "HASH"
                }
              ],
              "GlobalSecondaryIndexes": [
                {
                  "IndexName": "StatusTypeIndex",
                  "KeySchema": [
                    {
                      "AttributeName": "status",
                      "KeyType": "HASH"
                    },
                    {
                      "AttributeName": "transportType",
                      "KeyType": "RANGE"
                    }
                  ],
                  "Projection": {
                    "ProjectionType": "ALL"
                  }
                },
                {
                  "IndexName": "TransportTypeIndex",
                  "KeySchema": [
                    {
                      "AttributeName": "transportType",
                      "KeyType": "HASH"
                    }
                  ],
                  "Projection": {
                    "ProjectionType": "ALL"
                  }
                },
                {
                  "IndexName": "LicensePlateIndex",
                  "KeySchema": [
                    {
                      "AttributeName": "licensePlate",
                      "KeyType": "HASH"
                    }
                  ],
                  "Projection": {
                    "ProjectionType": "ALL"
                  }
                }
              ]
            }
          }
        },
        "Outputs": {
          "ApiEndpoint": {
            "Value": {
              "Fn::Join": [
                "",
                [
                  "https://",
                  {
                    "Ref": "HttpApi"
                  },
                  ".execute-api.",
                  {
                    "Ref": "AWS::Region"
                  },
                  ".amazonaws.com"
                ]
              ]
            },
            "Export": {
              "Name": "transport-system-management-dev-httpApiUrl"
            }
          }
        }
      }
    },
    "provider": {
      "name": "aws",
      "runtime": "nodejs20.x",
      "region": "eu-central-1",
      "stage": "dev",
      "timeout": 30,
      "environment": {
        "AWS_REGION": "eu-central-1",
        "AWS_DYNAMODB_ENDPOINT": "https://dynamodb.eu-central-1.amazonaws.com"
      },
      "iam": {
        "role": {
          "statements": [
            {
              "Effect": "Allow",
              "Action": [
                "dynamodb:DescribeTable",
                "dynamodb:CreateTable",
                "dynamodb:DeleteTable",
                "dynamodb:UpdateTable",
                "dynamodb:PutItem",
                "dynamodb:GetItem",
                "dynamodb:UpdateItem",
                "dynamodb:DeleteItem",
                "dynamodb:Query",
                "dynamodb:Scan",
                "dynamodb:TransactWriteItems"
              ],
              "Resource": [
                {
                  "Fn::GetAtt": [
                    "RoutesTable",
                    "Arn"
                  ]
                },
                {
                  "Fn::GetAtt": [
                    "VehiclesTable",
                    "Arn"
                  ]
                },
                {
                  "Fn::Join": [
                    "",
                    [
                      {
                        "Fn::GetAtt": [
                          "RoutesTable",
                          "Arn"
                        ]
                      },
                      "/index/*"
                    ]
                  ]
                },
                {
                  "Fn::Join": [
                    "",
                    [
                      {
                        "Fn::GetAtt": [
                          "VehiclesTable",
                          "Arn"
                        ]
                      },
                      "/index/*"
                    ]
                  ]
                }
              ]
            }
          ]
        }
      },
      "versionFunctions": true
    },
    "dashboard": {
      "isEnabledForService": false,
      "requiredAuthentication": false,
      "orgFeaturesInUse": null,
      "orgObservabilityIntegrations": null,
      "serviceAppId": null,
      "serviceProvider": null,
      "instanceParameters": null
    },
    "error": {
      "message": "Serverless command \"dynamodb start\" not found. Run \"serverless help\" for a list of all available commands.",
      "code": "UNRECOGNIZED_CLI_COMMAND"
    },
    "serviceRawFile": "service: transport-system-management\nframeworkVersion: \"4\"\n\nprovider:\n  name: aws\n  runtime: nodejs20.x\n  region: ${opt:region, 'eu-central-1'}\n  stage: ${opt:stage, 'dev'}\n  timeout: 30\n  environment:\n    AWS_REGION: ${self:provider.region}\n    AWS_DYNAMODB_ENDPOINT: https://dynamodb.${self:provider.region}.amazonaws.com\n  iam:\n    role:\n      statements:\n        - Effect: Allow\n          Action:\n            - dynamodb:DescribeTable\n            - dynamodb:CreateTable\n            - dynamodb:DeleteTable\n            - dynamodb:UpdateTable\n            - dynamodb:PutItem\n            - dynamodb:GetItem\n            - dynamodb:UpdateItem\n            - dynamodb:DeleteItem\n            - dynamodb:Query\n            - dynamodb:Scan\n            - dynamodb:TransactWriteItems\n          Resource:\n            - { \"Fn::GetAtt\": [\"RoutesTable\", \"Arn\"] }\n            - { \"Fn::GetAtt\": [\"VehiclesTable\", \"Arn\"] }\n            - { \"Fn::Join\": [\"\", [{ \"Fn::GetAtt\": [\"RoutesTable\", \"Arn\"] }, \"/index/*\"]] }\n            - { \"Fn::Join\": [\"\", [{ \"Fn::GetAtt\": [\"VehiclesTable\", \"Arn\"] }, \"/index/*\"]] }\n\nfunctions:\n  api:\n    handler: src/lambda.handler\n    events:\n      - httpApi: \"*\"\n\nplugins:\n  - serverless-offline\n\nbuild:\n  esbuild:\n    bundle: true\n    minify: false\n    sourcemap: true\n    target: node20\n    external:\n      - \"@aws-sdk/*\"\n\nresources:\n  Resources:\n    RoutesTable:\n      Type: AWS::DynamoDB::Table\n      Properties:\n        TableName: Routes\n        BillingMode: PAY_PER_REQUEST\n        AttributeDefinitions:\n          - AttributeName: id\n            AttributeType: S\n          - AttributeName: status\n            AttributeType: S\n          - AttributeName: vehicleId\n            AttributeType: S\n          - AttributeName: requiredTransportType\n            AttributeType: S\n        KeySchema:\n          - AttributeName: id\n            KeyType: HASH\n        GlobalSecondaryIndexes:\n          - IndexName: StatusIndex\n            KeySchema:\n              - AttributeName: status\n                KeyType: HASH\n            Projection:\n              ProjectionType: ALL\n          - IndexName: TransportTypeIndex\n            KeySchema:\n              - AttributeName: requiredTransportType\n                KeyType: HASH\n              - AttributeName: status\n                KeyType: RANGE\n            Projection:\n              ProjectionType: ALL\n          - IndexName: VehicleIdIndex\n            KeySchema:\n              - AttributeName: vehicleId\n                KeyType: HASH\n            Projection:\n              ProjectionType: ALL\n\n    VehiclesTable:\n      Type: AWS::DynamoDB::Table\n      Properties:\n        TableName: Vehicles\n        BillingMode: PAY_PER_REQUEST\n        AttributeDefinitions:\n          - AttributeName: id\n            AttributeType: S\n          - AttributeName: status\n            AttributeType: S\n          - AttributeName: transportType\n            AttributeType: S\n          - AttributeName: licensePlate\n            AttributeType: S\n        KeySchema:\n          - AttributeName: id\n            KeyType: HASH\n        GlobalSecondaryIndexes:\n          - IndexName: StatusTypeIndex\n            KeySchema:\n              - AttributeName: status\n                KeyType: HASH\n              - AttributeName: transportType\n                KeyType: RANGE\n            Projection:\n              ProjectionType: ALL\n          - IndexName: TransportTypeIndex\n            KeySchema:\n              - AttributeName: transportType\n                KeyType: HASH\n            Projection:\n              ProjectionType: ALL\n          - IndexName: LicensePlateIndex\n            KeySchema:\n              - AttributeName: licensePlate\n                KeyType: HASH\n            Projection:\n              ProjectionType: ALL\n\n  Outputs:\n    ApiEndpoint:\n      Value:\n        Fn::Join:\n          - \"\"\n          - - \"https://\"\n            - Ref: HttpApi\n            - \".execute-api.\"\n            - Ref: AWS::Region\n            - \".amazonaws.com\"\n      Export:\n        Name: ${self:service}-${self:provider.stage}-httpApiUrl\n",
    "command": [
      "dynamodb",
      "start"
    ],
    "options": {},
    "orgId": "6a03e4ef-d514-4067-bcc0-2342de814998",
    "orgName": "vladchuk66personal",
    "userId": "K7HqkGNTwCVRrVTTS5",
    "userName": "vladchuk66personal",
    "serviceProviderAwsAccountId": "836071699125",
    "serviceProviderAwsCfStackId": null,
    "serviceProviderAwsCfStackCreated": null,
    "serviceProviderAwsCfStackUpdated": null,
    "serviceProviderAwsCfStackStatus": null,
    "serviceProviderAwsCfStackOutputs": null
  }
}